{"id":"case-knowledge-ingestion-review","scope":"knowledge","proposal":"Ingest a publicly licensed, cited introductory record about formal circle geometry into a GAIA knowledge collection.","responsible_attention":{"observations":["Formal geometry is distinguishable from religious, cultural, and personal interpretation.","Source license, provenance, and claim scope require recording."],"uncertainty":"Historical/cultural interpretations need separate sources and authority.","affected_parties":["Knowledge users","Source authors/licensors","Relevant communities"],"alternatives":["Do not ingest","Ingest uncited general claim","Ingest scoped cited geometry record"]},"diamond":{"truth":"Require source, license, scope, and fact/interpretation separation.","care":"Do not flatten tradition-specific or restricted knowledge into generic data.","growth":"A scoped node supports learning and later governed contextual links.","balance":"Keep scope narrow; avoid universal metaphysical claims.","wisdom":"Proceed only with public, cited, licensed material and a correction path."},"authority":{"status":"authorized","consent_status":"not_required","subsidiarity":"Public formal geometry follows collection policy; restricted knowledge requires applicable authority.","hard_constraints":["No uncited production node","No restricted knowledge without authority","No symbolic-to-empirical causation claim"]},"decision":"proceed","feedback":{"metrics":["Source/license completeness","Claim traceability","Correction resolution","Epistemic-status completeness"],"review_at":"2027-03-13T00:00:00Z","repair_path":"Correct, retract, relabel, or remove on inadequate provenance, licensing, or scope."}}