{"id":"case-ai-tool-consent-refusal","scope":"personal","proposal":"Send an outbound message using a GAIAN agent without the account holder's explicit final approval.","responsible_attention":{"observations":["Outbound communication can have reputational and relational consequences.","No final approved recipient and message body were supplied."],"uncertainty":"Final user intent and recipient preferences are unknown.","affected_parties":["Account holder","Recipient","People represented in the message"],"alternatives":["Draft only","Request final approval","Refuse dispatch"]},"diamond":{"truth":"Unapproved text cannot be represented as final user communication.","care":"Unapproved sending violates agency and can cause harm.","growth":"A reviewable draft preserves future options.","balance":"Convenience does not outweigh consent.","wisdom":"Refuse dispatch and offer an approval workflow."},"authority":{"status":"not_authorized","consent_status":"missing","subsidiarity":"The account holder decides personal outbound communication.","hard_constraints":["Explicit final approval required","No impersonation","Audit if later approved"]},"decision":"refuse","feedback":{"metrics":["Refusal logged","No outbound message transmitted"],"review_at":"2026-09-14T00:00:00Z","repair_path":"Allow a new record after the account holder supplies approved recipient and exact text."}}