{"id":"case-wetland-restoration","scope":"community","proposal":"Run only a reversible wetland-restoration access pilot after legitimate local authority and affected-party review.","responsible_attention":{"observations":["Baseline habitat, water-quality, and flood-risk evidence is required.","Public access can benefit stewardship but can disturb habitat."],"uncertainty":"Long-term habitat response and maintenance burden are uncertain.","affected_parties":["Local residents","Land stewards","Habitat and species","Future users"],"alternatives":["Monitor without intervention","Restore without public access","Use seasonal limited access with monitoring"]},"diamond":{"truth":"Use provenance-bearing baseline observations and label uncertainty.","care":"Avoid disturbance and provide participation and appeal routes.","growth":"A limited pilot may build restoration knowledge and stewardship.","balance":"Balance access, habitat, flood resilience, cost, and maintenance.","wisdom":"Escalate to legitimate authorities before any site action."},"authority":{"status":"requires_escalation","consent_status":"missing","subsidiarity":"Land stewards and affected local authorities decide; GAIA may only support analysis.","hard_constraints":["No site work before authority and consent","No restricted ecological or cultural publication","No irreversible construction"]},"decision":"escalate","feedback":{"metrics":["Water quality","Habitat condition","Biodiversity observations","Flood-buffer performance","Access equity"],"review_at":"2027-03-13T00:00:00Z","repair_path":"Pause or remove access features if agreed habitat thresholds worsen; revise with affected authorities."}}