{"id":"case-community-space-design","scope":"infrastructure","proposal":"Create a hypothetical community-center design packet using open tools, accessibility review, biophilic design, and visible consultation status.","responsible_attention":{"observations":["This is a paper-first hypothetical design, not a built or certified project.","Access, maintenance, energy, carbon, culture, and safety can conflict."],"uncertainty":"No site-specific evidence or consultation outcome exists.","affected_parties":["Potential users","Community knowledge holders","Operators","Local ecosystems"],"alternatives":["Create no packet","Create generic design without consultation status","Create open hypothetical packet with explicit unknowns"]},"diamond":{"truth":"State hypothetical status and assumptions.","care":"Accessibility, cultural respect, safety, and privacy are required review criteria.","growth":"The packet can support learning and local adaptation.","balance":"Expose energy, carbon, access, biophilia, cost, and maintenance tradeoffs.","wisdom":"Narrow work to an educational artifact; require consultation for real-site implementation."},"authority":{"status":"authorized","consent_status":"not_required","subsidiarity":"Project may publish a hypothetical packet; real-site work requires site/community authority.","hard_constraints":["No false certification or consultation claim","No restricted cultural pattern","Accessibility review required"]},"decision":"narrow","feedback":{"metrics":["Accessibility completeness","Assumption transparency","Consultation-status visibility","Open-tool reproducibility"],"review_at":"2026-12-13T00:00:00Z","repair_path":"Correct representations and revise on community feedback or site evidence."}}