{"id":"case-education-pathway","scope":"personal","proposal":"Offer a local, learner-directed introductory path for systems thinking and environmental data literacy.","responsible_attention":{"observations":["Learner requested a self-paced path.","A recommendation is not a credential, diagnosis, or mandate."],"uncertainty":"Knowledge, access needs, language, and time may change.","affected_parties":["Learner","Resource authors","Communities represented by examples"],"alternatives":["No recommendation","Fixed path","Editable sourced path with opt-out choices"]},"diamond":{"truth":"Cite resources and distinguish guidance from qualification.","care":"Respect pace, privacy, access needs, and refusal of profiling.","growth":"Support transferable skills and learner-defined goals.","balance":"Avoid overload and a narrow canon while retaining structure.","wisdom":"Proceed with a low-stakes editable local path."},"authority":{"status":"authorized","consent_status":"valid","subsidiarity":"Learner controls goals and can revise, export, or delete local records.","hard_constraints":["No hidden profiling","No professional-license claim","No sharing without consent"]},"decision":"proceed","feedback":{"metrics":["Learner usefulness","Resource accessibility","Goal revision","Citation completeness"],"review_at":"2026-10-13T00:00:00Z","repair_path":"Learner may change, stop, correct, or delete; replace unsupported resources."}}